{
  "generated_at": "2026-10-26T11:39:56.400796Z",
  "model_version": "dc-xg-xi0.0025-prior0.5-alpha0.50",
  "teams": [
    {
      "team": "Arsenal",
      "attack": 0.35827321988635485,
      "defence": 0.6599036876776242,
      "overall": 1.018176907563979
    },
    {
      "team": "Aston Villa",
      "attack": 0.15877021659521878,
      "defence": 0.11891906681238233,
      "overall": 0.27768928340760113
    },
    {
      "team": "Bournemouth",
      "attack": 0.25383944014785537,
      "defence": 0.1078362100597961,
      "overall": 0.36167565020765147
    },
    {
      "team": "Brentford",
      "attack": 0.26628111318820574,
      "defence": 0.10547348413082304,
      "overall": 0.37175459731902877
    },
    {
      "team": "Brighton",
      "attack": 0.3288585613512758,
      "defence": 0.17637608085555231,
      "overall": 0.5052346422068281
    },
    {
      "team": "Chelsea",
      "attack": 0.33654026764556016,
      "defence": 0.10687187560633897,
      "overall": 0.44341214325189915
    },
    {
      "team": "Coventry City",
      "attack": -0.1583973791907239,
      "defence": -0.07487292503867647,
      "overall": -0.23327030422940037
    },
    {
      "team": "Crystal Palace",
      "attack": 0.11933595198783704,
      "defence": 0.01838849209771215,
      "overall": 0.13772444408554918
    },
    {
      "team": "Everton",
      "attack": -0.02804125743758939,
      "defence": 0.16899545683068476,
      "overall": 0.14095419939309536
    },
    {
      "team": "Fulham",
      "attack": 0.042238183195497964,
      "defence": 0.12572107861108858,
      "overall": 0.16795926180658655
    },
    {
      "team": "Hull City",
      "attack": -0.14822886262190232,
      "defence": 0.03847111853527694,
      "overall": -0.10975774408662539
    },
    {
      "team": "Ipswich Town",
      "attack": 0.06247292298389159,
      "defence": -0.18236806138656905,
      "overall": -0.11989513840267746
    },
    {
      "team": "Leeds United",
      "attack": 0.13592196142991358,
      "defence": 0.15855144553300188,
      "overall": 0.29447340696291546
    },
    {
      "team": "Liverpool",
      "attack": 0.3747543210936124,
      "defence": 0.24703684220160196,
      "overall": 0.6217911632952143
    },
    {
      "team": "Manchester City",
      "attack": 0.49700653898237307,
      "defence": 0.35247231336624424,
      "overall": 0.8494788523486173
    },
    {
      "team": "Manchester United",
      "attack": 0.26403985761046617,
      "defence": 0.13723637682701836,
      "overall": 0.4012762344374845
    },
    {
      "team": "Newcastle United",
      "attack": 0.23801380820937967,
      "defence": 0.052377065649563,
      "overall": 0.2903908738589427
    },
    {
      "team": "Nottingham Forest",
      "attack": 0.046741984339078384,
      "defence": 0.13713156373088395,
      "overall": 0.18387354806996234
    },
    {
      "team": "Sunderland",
      "attack": -0.05958442244437164,
      "defence": 0.06511877503088356,
      "overall": 0.005534352586511922
    },
    {
      "team": "Tottenham Hotspur",
      "attack": 0.049329582338450764,
      "defence": 0.047258183319453105,
      "overall": 0.09658776565790386
    }
  ],
  "history": [
    {
      "date": "2026-10-12",
      "team": "Arsenal",
      "attack": 0.40632268103271213,
      "defence": 0.6589678280064568,
      "overall": 1.0652905090391689
    },
    {
      "date": "2026-10-12",
      "team": "Aston Villa",
      "attack": 0.20157711940113635,
      "defence": 0.10876588902713243,
      "overall": 0.3103430084282688
    },
    {
      "date": "2026-10-12",
      "team": "Bournemouth",
      "attack": 0.19597519846704894,
      "defence": 0.12305821008414784,
      "overall": 0.3190334085511968
    },
    {
      "date": "2026-10-12",
      "team": "Brentford",
      "attack": 0.2631421359925155,
      "defence": 0.14318166192699927,
      "overall": 0.4063237979195148
    },
    {
      "date": "2026-10-12",
      "team": "Brighton",
      "attack": 0.32941705010987427,
      "defence": 0.17147128134521974,
      "overall": 0.500888331455094
    },
    {
      "date": "2026-10-12",
      "team": "Chelsea",
      "attack": 0.29989919815035543,
      "defence": 0.052194583006936586,
      "overall": 0.352093781157292
    },
    {
      "date": "2026-10-12",
      "team": "Coventry City",
      "attack": -0.3790266085296329,
      "defence": -0.094786588315417,
      "overall": -0.47381319684504986
    },
    {
      "date": "2026-10-12",
      "team": "Crystal Palace",
      "attack": 0.01679442125455974,
      "defence": 0.04263260415698811,
      "overall": 0.059427025411547846
    },
    {
      "date": "2026-10-12",
      "team": "Everton",
      "attack": -0.0353721537470356,
      "defence": 0.25023125846179467,
      "overall": 0.21485910471475905
    },
    {
      "date": "2026-10-12",
      "team": "Fulham",
      "attack": 0.029586434578503774,
      "defence": 0.11901679741489854,
      "overall": 0.1486032319934023
    },
    {
      "date": "2026-10-12",
      "team": "Hull City",
      "attack": -0.10057282033491956,
      "defence": 0.15438622384673567,
      "overall": 0.05381340351181611
    },
    {
      "date": "2026-10-12",
      "team": "Ipswich Town",
      "attack": -0.020481620805514553,
      "defence": -0.2195386001421438,
      "overall": -0.24002022094765835
    },
    {
      "date": "2026-10-12",
      "team": "Leeds United",
      "attack": 0.0996904514835742,
      "defence": 0.21823060604200872,
      "overall": 0.3179210575255829
    },
    {
      "date": "2026-10-12",
      "team": "Liverpool",
      "attack": 0.4040330849323032,
      "defence": 0.2239436437004387,
      "overall": 0.6279767286327419
    },
    {
      "date": "2026-10-12",
      "team": "Manchester City",
      "attack": 0.5457518512452592,
      "defence": 0.4529926776433089,
      "overall": 0.9987445288885681
    },
    {
      "date": "2026-10-12",
      "team": "Manchester United",
      "attack": 0.29471769128509473,
      "defence": 0.12545979698046836,
      "overall": 0.4201774882655631
    },
    {
      "date": "2026-10-12",
      "team": "Newcastle United",
      "attack": 0.3005772890021472,
      "defence": 0.05277094280531309,
      "overall": 0.3533482318074603
    },
    {
      "date": "2026-10-12",
      "team": "Nottingham Forest",
      "attack": 0.05957753491486659,
      "defence": 0.17729751372571195,
      "overall": 0.23687504864057854
    },
    {
      "date": "2026-10-12",
      "team": "Sunderland",
      "attack": -0.02402337804991855,
      "defence": 0.1153936588582885,
      "overall": 0.09137028080836995
    },
    {
      "date": "2026-10-12",
      "team": "Tottenham Hotspur",
      "attack": 0.07084261283891019,
      "defence": -0.024777275122369224,
      "overall": 0.04606533771654096
    },
    {
      "date": "2026-10-13",
      "team": "Arsenal",
      "attack": 0.40054293817836106,
      "defence": 0.658827533414938,
      "overall": 1.059370471593299
    },
    {
      "date": "2026-10-13",
      "team": "Aston Villa",
      "attack": 0.19952837780819033,
      "defence": 0.10366720882075034,
      "overall": 0.30319558662894064
    },
    {
      "date": "2026-10-13",
      "team": "Bournemouth",
      "attack": 0.17981381987883482,
      "defence": 0.06944865685852057,
      "overall": 0.2492624767373554
    },
    {
      "date": "2026-10-13",
      "team": "Brentford",
      "attack": 0.2619989349325002,
      "defence": 0.13900290727493358,
      "overall": 0.4010018422074338
    },
    {
      "date": "2026-10-13",
      "team": "Brighton",
      "attack": 0.325736540475133,
      "defence": 0.20469168449866904,
      "overall": 0.530428224973802
    },
    {
      "date": "2026-10-13",
      "team": "Chelsea",
      "attack": 0.3382589308864785,
      "defence": 0.062318340200328406,
      "overall": 0.4005772710868069
    },
    {
      "date": "2026-10-13",
      "team": "Coventry City",
      "attack": -0.1777434375891287,
      "defence": -0.05210222653337462,
      "overall": -0.22984566412250332
    },
    {
      "date": "2026-10-13",
      "team": "Crystal Palace",
      "attack": 0.04492745384504617,
      "defence": 0.05070829982913899,
      "overall": 0.09563575367418517
    },
    {
      "date": "2026-10-13",
      "team": "Everton",
      "attack": -0.02315031271811457,
      "defence": 0.23568125114840469,
      "overall": 0.2125309384302901
    },
    {
      "date": "2026-10-13",
      "team": "Fulham",
      "attack": 0.008167134079948275,
      "defence": 0.11067408528611271,
      "overall": 0.11884121936606099
    },
    {
      "date": "2026-10-13",
      "team": "Hull City",
      "attack": -0.0506267280663385,
      "defence": 0.10543675768412118,
      "overall": 0.05481002961778268
    },
    {
      "date": "2026-10-13",
      "team": "Ipswich Town",
      "attack": 0.00825384171351323,
      "defence": -0.1914735823121814,
      "overall": -0.18321974059866816
    },
    {
      "date": "2026-10-13",
      "team": "Leeds United",
      "attack": 0.09975891392850413,
      "defence": 0.215392368852191,
      "overall": 0.31515128278069515
    },
    {
      "date": "2026-10-13",
      "team": "Liverpool",
      "attack": 0.37318863449252104,
      "defence": 0.20350003705998007,
      "overall": 0.5766886715525011
    },
    {
      "date": "2026-10-13",
      "team": "Manchester City",
      "attack": 0.5486648309894759,
      "defence": 0.4978224236368375,
      "overall": 1.0464872546263133
    },
    {
      "date": "2026-10-13",
      "team": "Manchester United",
      "attack": 0.2676899799959108,
      "defence": 0.13696567161893602,
      "overall": 0.40465565161484685
    },
    {
      "date": "2026-10-13",
      "team": "Newcastle United",
      "attack": 0.27763940054938946,
      "defence": 0.009221122464509913,
      "overall": 0.28686052301389936
    },
    {
      "date": "2026-10-13",